{
  "approval_record_hash": "sha256:17be991976ac2f2e07fc295ef29249926c6313b5054a8bc4b48bc86fb731b3af",
  "authorization_record_hash": "sha256:3d6777f5501c52ccd9848267a6f69154ec27ca333f0e689144c93876b3b9501d",
  "candidate_hash": "sha256:556083dd71ed01078f5bd1a6164abd88660824ed2170030d0bfa13f0cdd00b6d",
  "generated_at": "2026-01-01T00:00:00Z",
  "manifest_hash": "sha256:e68bce8b2ce7164d428e8ed3eeb274d856e961479cd77c2429cbbe3d4031389c",
  "manifest_id": "audit_8b7586d03460e9375920c91d",
  "verification_result_hash": "sha256:310b1bbad7a629b9f792615d4d3b6ad2b2abe9e7dd6da3a76ab06eaf5095722f"
}
